<?xml version="1.0" encoding="UTF-8"?>
<configs xmlns:xsi="http://www.w3.org/2001/XMLSchema-instance"
         xsi:noNamespaceSchemaLocation="configs.xsd">
    <metaServer>
        <hostname>dc02.utdallas.edu</hostname>
        <receiveHeartbeatPort>50001</receiveHeartbeatPort>
        <clientPort>50003</clientPort>
        <ackPort>50006</ackPort>
        <replicaPort>50007</replicaPort>
    </metaServer>

    <fileServers>
        <fileServer>
            <id>1</id>
            <hostname>dc03.utdallas.edu</hostname>
            <receiveMetaFilePort>50002</receiveMetaFilePort>
            <requestFilePort>50004</requestFilePort>
            <commandPort>50005</commandPort>
            <storageDir>files1</storageDir>
        </fileServer>
        <fileServer>
            <id>2</id>
            <hostname>dc05.utdallas.edu</hostname>
            <receiveMetaFilePort>50002</receiveMetaFilePort>
            <requestFilePort>50004</requestFilePort>
            <commandPort>50005</commandPort>
            <storageDir>files2</storageDir>
        </fileServer>
        <fileServer>
            <id>3</id>
            <hostname>dc08.utdallas.edu</hostname>
            <receiveMetaFilePort>50002</receiveMetaFilePort>
            <requestFilePort>50004</requestFilePort>
            <commandPort>50005</commandPort>
            <storageDir>files3</storageDir>
        </fileServer>
    </fileServers>

</configs>